{
  "schema_version": 1,
  "verified_at": "2026-08-30T00:00:00+09:00",
  "public_burdens": [
    {"public_burden_id": "income-tax-example", "name": "所得税（契約fixture）", "category": "national_tax"},
    {"public_burden_id": "consumption-tax-example", "name": "消費税（契約fixture）", "category": "national_and_local_tax"},
    {"public_burden_id": "employee-pension-example", "name": "厚生年金保険料（契約fixture）", "category": "social_insurance_premium"}
  ],
  "legal_sources": [
    {"legal_source_id": "income-tax-law-example", "source_type": "law", "title": "所得税法（fixture）", "item_number": "第X条", "item_text": "課税所得区分ごとの税率を定めるfixture文言", "source_url": "https://example.go.jp/law/income-tax", "dates": [{"event_type": "promulgated", "date": "2020-01-01", "date_raw": "令和2年1月1日"}], "relationships": []},
    {"legal_source_id": "consumption-tax-law-example", "source_type": "law", "title": "消費税法（fixture）", "item_number": "第X条", "item_text": "標準区分の率を定めるfixture文言", "source_url": "https://example.go.jp/law/consumption-tax", "dates": [{"event_type": "enforced", "date": "2019-10-01", "date_raw": "令和元年10月1日"}], "relationships": []},
    {"legal_source_id": "local-tax-law-example", "source_type": "law", "title": "地方税法（fixture）", "item_number": "第X条", "item_text": "地方消費税の配分を定めるfixture文言", "source_url": "https://example.go.jp/law/local-tax", "dates": [{"event_type": "enforced", "date": "2019-10-01", "date_raw": "令和元年10月1日"}], "relationships": [{"relationship_type": "references", "target_legal_source_id": "consumption-tax-law-example"}]},
    {"legal_source_id": "pension-law-example", "source_type": "law", "title": "厚生年金保険法（fixture）", "item_number": "第X条", "item_text": "保険料率と負担関係を定めるfixture文言", "source_url": "https://example.go.jp/law/pension", "dates": [{"event_type": "enforced", "date": "2017-09-01", "date_raw": "平成29年9月1日"}], "relationships": []},
    {"legal_source_id": "pension-rule-example", "source_type": "enforcement_regulation", "title": "厚生年金保険法施行規則（fixture）", "item_number": "第X条", "item_text": "納付手続を定めるfixture文言", "source_url": "https://example.go.jp/rule/pension", "dates": [{"event_type": "promulgated", "date": "2017-08-01", "date_raw": "平成29年8月1日"}], "relationships": [{"relationship_type": "delegated_by", "target_legal_source_id": "pension-law-example"}]}
  ],
  "source_facts": [
    {"source_fact_id": "income-low-rate", "legal_source_id": "income-tax-law-example", "fact_kind": "rate", "value_raw": "百分の五", "normalized_value": 5, "unit": "percent", "subject_conditions": "課税所得の低位区分", "verified_at": "2026-08-30T00:00:00+09:00"},
    {"source_fact_id": "income-high-rate", "legal_source_id": "income-tax-law-example", "fact_kind": "rate", "value_raw": "百分の十", "normalized_value": 10, "unit": "percent", "subject_conditions": "課税所得の次区分", "verified_at": "2026-08-30T00:00:00+09:00"},
    {"source_fact_id": "consumption-total-rate", "legal_source_id": "consumption-tax-law-example", "fact_kind": "rate", "value_raw": "百分の十", "normalized_value": 10, "unit": "percent", "subject_conditions": "標準課税対象", "verified_at": "2026-08-30T00:00:00+09:00"},
    {"source_fact_id": "consumption-national-rate", "legal_source_id": "consumption-tax-law-example", "fact_kind": "rate", "value_raw": "百分の七・八", "normalized_value": 7.8, "unit": "percent", "subject_conditions": "標準課税対象の国税component", "verified_at": "2026-08-30T00:00:00+09:00"},
    {"source_fact_id": "pension-total-rate", "legal_source_id": "pension-law-example", "fact_kind": "rate", "value_raw": "千分の百八十三", "normalized_value": 18.3, "unit": "percent", "subject_conditions": "被用者と事業主の合計", "verified_at": "2026-08-30T00:00:00+09:00"}
  ],
  "calculation_sets": [
    {"calculation_set_id": "consumption-local-allocation", "method": "explicit_allocation", "input_source_fact_ids": ["consumption-total-rate"], "output_component_ids": ["consumption-local-component"], "allocation": {"consumption-local-component": 0.22}, "rounding": "none"},
    {"calculation_set_id": "pension-equal-split", "method": "equal_split", "input_source_fact_ids": ["pension-total-rate"], "output_component_ids": ["pension-insured-component", "pension-employer-component"], "rounding": "none"}
  ],
  "burden_components": [
    {"component_id": "income-low-component", "public_burden_id": "income-tax-example", "name": "累進区分1", "versions": [{"version_id": "income-low-current", "subject_conditions": "課税所得の低位区分に属する部分", "calculation_bases": [{"calculation_basis_id": "taxable-income-band", "description": "当該区分に属する課税所得"}], "liable_parties": [{"party_id": "individual-taxpayer", "description": "個人納税者"}], "payment_obligors": ["個人納税者"], "value": {"value_kind": "rate", "numeric_value": 5, "unit": "percent", "acquisition_type": "direct", "source_fact_id": "income-low-rate"}, "application_start": "2020-01-01", "application_start_raw": "令和2年1月1日以後", "application_end": null, "legal_source_ids": ["income-tax-law-example"]}]},
    {"component_id": "income-high-component", "public_burden_id": "income-tax-example", "name": "累進区分2", "versions": [{"version_id": "income-high-current", "subject_conditions": "課税所得の次区分に属する部分", "calculation_bases": [{"calculation_basis_id": "taxable-income-band", "description": "当該区分に属する課税所得"}], "liable_parties": [{"party_id": "individual-taxpayer", "description": "個人納税者"}], "payment_obligors": ["個人納税者"], "value": {"value_kind": "rate", "numeric_value": 10, "unit": "percent", "acquisition_type": "direct", "source_fact_id": "income-high-rate"}, "application_start": "2020-01-01", "application_start_raw": "令和2年1月1日以後", "application_end": null, "legal_source_ids": ["income-tax-law-example"]}]},
    {"component_id": "consumption-national-component", "public_burden_id": "consumption-tax-example", "name": "標準区分国税分", "versions": [{"version_id": "consumption-national-current", "subject_conditions": "標準課税対象", "calculation_bases": [{"calculation_basis_id": "tax-exclusive-price", "description": "税抜価格"}], "liable_parties": [{"party_id": "consumer", "description": "消費者"}], "payment_obligors": ["課税事業者"], "value": {"value_kind": "rate", "numeric_value": 7.8, "unit": "percent", "acquisition_type": "direct", "source_fact_id": "consumption-national-rate"}, "application_start": "2019-10-01", "application_start_raw": "令和元年10月1日", "application_end": null, "legal_source_ids": ["consumption-tax-law-example"]}]},
    {"component_id": "consumption-local-component", "public_burden_id": "consumption-tax-example", "name": "標準区分地方税分", "versions": [{"version_id": "consumption-local-current", "subject_conditions": "標準課税対象", "calculation_bases": [{"calculation_basis_id": "tax-exclusive-price", "description": "税抜価格"}], "liable_parties": [{"party_id": "consumer", "description": "消費者"}], "payment_obligors": ["課税事業者"], "value": {"value_kind": "rate", "numeric_value": 2.2, "unit": "percent", "acquisition_type": "calculated", "calculation_set_id": "consumption-local-allocation"}, "application_start": "2019-10-01", "application_start_raw": "令和元年10月1日", "application_end": null, "legal_source_ids": ["consumption-tax-law-example", "local-tax-law-example"]}]},
    {"component_id": "pension-insured-component", "public_burden_id": "employee-pension-example", "name": "被保険者負担", "versions": [{"version_id": "pension-insured-past", "subject_conditions": "被保険者負担", "calculation_bases": [{"calculation_basis_id": "standard-monthly-remuneration", "description": "標準報酬月額"}], "liable_parties": [{"party_id": "insured-person", "description": "被保険者"}], "payment_obligors": ["事業主"], "value": {"value_kind": "rate", "numeric_value": 9.15, "unit": "percent", "acquisition_type": "calculated", "calculation_set_id": "pension-equal-split"}, "application_start": "2017-09-01", "application_start_raw": "平成29年9月1日", "application_end": "2025-12-31", "legal_source_ids": ["pension-law-example", "pension-rule-example"]}, {"version_id": "pension-insured-current", "subject_conditions": "被保険者負担", "calculation_bases": [{"calculation_basis_id": "standard-monthly-remuneration", "description": "標準報酬月額"}, {"calculation_basis_id": "standard-bonus", "description": "標準賞与額"}], "liable_parties": [{"party_id": "insured-person", "description": "被保険者"}], "payment_obligors": ["事業主"], "value": {"value_kind": "rate", "numeric_value": 9.15, "unit": "percent", "acquisition_type": "calculated", "calculation_set_id": "pension-equal-split"}, "application_start": "2026-01-01", "application_start_raw": "令和8年1月1日", "application_end": null, "legal_source_ids": ["pension-law-example", "pension-rule-example"]}]},
    {"component_id": "pension-employer-component", "public_burden_id": "employee-pension-example", "name": "事業主負担", "versions": [{"version_id": "pension-employer-future", "subject_conditions": "事業主負担", "calculation_bases": [{"calculation_basis_id": "standard-monthly-remuneration", "description": "標準報酬月額"}], "liable_parties": [{"party_id": "employer", "description": "事業主"}], "payment_obligors": ["事業主"], "value": {"value_kind": "rate", "numeric_value": 9.15, "unit": "percent", "acquisition_type": "calculated", "calculation_set_id": "pension-equal-split"}, "application_start": "2027-01-01", "application_start_raw": "令和9年1月1日", "application_end": null, "legal_source_ids": ["pension-law-example", "pension-rule-example"]}]}
  ]
}
